<?xml version="1.0" encoding="UTF-8"?>
<!DOCTYPE games SYSTEM "games.dtd" >

<games version="0.2">
	<game id="q3a">
		<gamename>Quake III Arena</gamename>
		<gameicon>quake3</gameicon>			<!--  For Linux/OSX, this will be a PNG file; for Windows, it will be a gif -->
		<servertype>q3s</servertype>
		<cheatprotection>punkbuster</cheatprotection>
		<mod id="baseq3">
			<modname>BaseQ3</modname>
			<moddiscrim>gametype</moddiscrim>
			<customnames>false</customnames>
			<gametype id="0">FFA</gametype>
			<gametype id="1">Duel</gametype>
			<gametype id="3">TDM</gametype>
			<gametype id="4">CTF</gametype>
		</mod>
		<mod id="osp">
			<modname>OSP</modname>
			<modicon>osp</modicon>
			<moddiscrim>gametype</moddiscrim> 
			<customnames>false</customnames>
			<gametype id="0">FFA</gametype>
			<gametype id="1">Duel</gametype>
			<gametype id="3">TDM</gametype>
			<gametype id="4">CTF</gametype>
			<gametype id="5">Clan Arena</gametype>
			<gametype id="6">Freeze Tag</gametype>
		</mod>
		<mod id="cpma">
			<modname>CPMA</modname>
			<modicon>cpma</modicon>
			<moddiscrim>gametype</moddiscrim> 
			<customnames>false</customnames>
			<gametype id="0">FFA</gametype>
			<gametype id="1">Duel</gametype>
			<gametype id="3">TDM</gametype>
			<gametype id="4">CTF</gametype>
			<gametype id="5">Clan Arena</gametype>
			<gametype id="6">Freeze Tag</gametype>
			<gametype id="7">Capture Strike</gametype>
		</mod>
		<mod id="arena">
			<modname>Rocket Arena</modname>
			<modicon>ra3</modicon>
			<moddiscrim>gameversion</moddiscrim>
			<customnames>false</customnames>
			<gametype id="1.8b">1.8b</gametype>
			<gametype id="1.76a">1.76a</gametype>
			<gametype id="1.76">1.76</gametype>
		</mod>
		<mod id="threewave">
			<modname>Threewave</modname>
			<modicon>threewave</modicon>
			<moddiscrim>gametype</moddiscrim>
			<customnames>false</customnames>
			<gametype id="0">Threewave CTF</gametype>
			<gametype id="1">Classic CTF</gametype>
			<gametype id="2">Capture Strike</gametype>
			<gametype id="3">Threewave FFA</gametype>
			<gametype id="4">Threewave TDM</gametype>
		</mod>
		<mod id="beryllium">
			<modname>Beryllium</modname>
			<moddiscrim>gametype</moddiscrim>
			<team1name>Blue</team1name>
			<team2name>Red</team2name>
			<customnames>false</customnames>
			<gametype id="0">FFA</gametype>
			<gametype id="1">Duel</gametype>
			<gametype id="3">TDM</gametype>
			<gametype id="4">CTF</gametype>
		</mod>
		<mod id="defrag">
			<modname>DeFrag</modname>
			<moddiscrim>gametype</moddiscrim>
			<customnames>false</customnames>
			<gametype id="0">Auto Config</gametype>
			<gametype id="1">Single Player DeFrag</gametype>
			<gametype id="2">Single Player Tricks</gametype>
			<gametype id="3">Single Player Fastcaps</gametype>
			<gametype id="4">Multiplayer Defrag</gametype>
			<gametype id="5">Multiplayer Tricks</gametype>
			<gametype id="6">Multiplayer Fastcaps</gametype>
		</mod>
		<mod id="epic">
			<modname>Epic</modname>
			<moddiscrim>gametype</moddiscrim>
			<team1name>Blue</team1name>
			<team2name>Red</team2name>
			<customnames>false</customnames>
			<gametype id="0">FFA</gametype>
			<gametype id="1">Duel</gametype>
			<gametype id="3">TDM</gametype>
			<gametype id="4">CTF</gametype>
		</mod>
		<mod id="excessive">
			<modname>Excessive Plus</modname>
			<moddiscrim>gametype</moddiscrim>
			<team1name>Blue</team1name>
			<team2name>Red</team2name>
			<customnames>false</customnames>
			<gametype id="0">FFA</gametype>
			<gametype id="1">Duel</gametype>
			<gametype id="3">TDM</gametype>
			<gametype id="4">CTF</gametype>
		</mod>
		<mod id="freeze">
			<modname>Freeze Tag</modname>
			<moddiscrim>gametype</moddiscrim>
			<team1name>Blue</team1name>
			<team2name>Red</team2name>
			<customnames>false</customnames>
			<gametype id="0">FFA</gametype>
			<gametype id="1">Duel</gametype>
			<gametype id="3">TDM</gametype>
			<gametype id="4">CTF</gametype>
		</mod>
		<mod id="instaunlagged">
			<modname>Insta-Unlagged</modname>
			<moddiscrim>gametype</moddiscrim>
			<team1name>Blue</team1name>
			<team2name>Red</team2name>
			<customnames>false</customnames>
			<gametype id="0">FFA</gametype>
			<gametype id="1">Duel</gametype>
			<gametype id="3">TDM</gametype>
			<gametype id="4">CTF</gametype>
		</mod>
		<mod id="unlagged">
			<modname>Unlagged</modname>
			<moddiscrim>gametype</moddiscrim>
			<team1name>Blue</team1name>
			<team2name>Red</team2name>
			<customnames>false</customnames>
			<gametype id="0">FFA</gametype>
			<gametype id="1">Duel</gametype>
			<gametype id="3">TDM</gametype>
			<gametype id="4">CTF</gametype>
		</mod>
		<mod id="pkarena">
			<modname>Pain Keep Arena</modname>
			<moddiscrim>gametype</moddiscrim>
			<team1name>Blue</team1name>
			<team2name>Red</team2name>
			<customnames>false</customnames>
			<gametype id="0">FFA</gametype>
			<gametype id="1">Duel</gametype>
			<gametype id="3">TDM</gametype>
			<gametype id="4">CTF</gametype>
		</mod>
		<mod id="excessiveplus">
			<modname>Excessive Plus</modname>
			<moddiscrim>gametype</moddiscrim>
			<team1name>Blue</team1name>
			<team2name>Red</team2name>
			<customnames>false</customnames>
			<gametype id="0">FFA</gametype>
			<gametype id="1">Duel</gametype>
			<gametype id="3">TDM</gametype>
			<gametype id="4">CTF</gametype>
		</mod>
		<mod id="q3f2">
			<modname>Fortress 2</modname>
			<modicon>q3f</modicon>
			<moddiscrim>gametype</moddiscrim>
			<team1name>Blue</team1name>
			<team2name>Red</team2name>
			<customnames>false</customnames>
			<gametype id="1">Tournament</gametype>
			<gametype id="2">FFA</gametype>
			<gametype id="3">TDN</gametype>
			<gametype id="4">CTF</gametype>
			<gametype id="5">Fortress</gametype>
		</mod>
		<mod id="ufreeze">
			<modname>Ultra Freeze Tag</modname>
			<moddiscrim>gametype</moddiscrim>
			<team1name>Blue</team1name>
			<team2name>Red</team2name>
			<customnames>false</customnames>
			<gametype id="0">FFA</gametype>
			<gametype id="1">Duel</gametype>
			<gametype id="3">TDM</gametype>
			<gametype id="4">CTF</gametype>
		</mod>
		<mod id="westernq3">
			<modname>Western Quake</modname>
			<modicon>wq3</modicon>
			<moddiscrim>gametype</moddiscrim>
			<team1name>Blue</team1name>
			<team2name>Red</team2name>
			<customnames>false</customnames>
			<gametype id="0">FFA</gametype>
			<gametype id="1">Duel</gametype>
			<gametype id="3">TDM</gametype>
			<gametype id="4">CTF</gametype>
		</mod>
		<mod id="battle">
			<modname>X-Battle</modname>
			<modicon>battle</modicon>
			<moddiscrim>gametype</moddiscrim>
			<team1name>Blue</team1name>
			<team2name>Red</team2name>
			<customnames>false</customnames>
			<gametype id="0">FFA</gametype>
			<gametype id="1">Duel</gametype>
			<gametype id="3">TDM</gametype>
			<gametype id="4">CTF</gametype>
		</mod>
		<ignore attrib="mod">q3ut2</ignore>
		<ignore attrib="mod">q3ut3</ignore>
		<ignore attrib="mod">q3ut4</ignore>
		<ignore attrib="mod">q3ut42</ignore>
	</game>
	<game id="urt">
		<gamename>Urban Terror</gamename>
		<gameicon>q3ut</gameicon>
		<servertype>q3s</servertype>
		<mod id="q3ut2">
			<modname>Urban Terror 2</modname>
			<modicon>q3ut</modicon>
			<moddiscrim>gametype</moddiscrim>
			<customnames>true</customnames>
			<gametype id="0">FFA</gametype>
			<gametype id="3">TDM</gametype>
			<gametype id="4">TS</gametype>
			<gametype id="5">FTL</gametype>
			<gametype id="6">CAH</gametype>
			<gametype id="7">CTF</gametype>
			<gametype id="8">Bomb</gametype>
		</mod>
		<mod id="q3ut3">
			<modname>Urban Terror 3</modname>
			<modicon>q3ut</modicon>
			<moddiscrim>gametype</moddiscrim>
			<customnames>true</customnames>
			<gametype id="0">FFA</gametype>
			<gametype id="3">TDM</gametype>
			<gametype id="4">TS</gametype>
			<gametype id="5">FTL</gametype>
			<gametype id="6">CAH</gametype>
			<gametype id="7">CTF</gametype>
			<gametype id="8">Bomb</gametype>
		</mod>
		<mod id="q3ut4">
			<modname>Urban Terror 4</modname>
			<modicon>q3ut</modicon>
			<moddiscrim>gametype</moddiscrim>
			<customnames>true</customnames>
			<gametype id="0">FFA</gametype>
			<gametype id="3">TDM</gametype>
			<gametype id="4">TS</gametype>
			<gametype id="5">FTL</gametype>
			<gametype id="6">CAH</gametype>
			<gametype id="7">CTF</gametype>
			<gametype id="8">Bomb</gametype>
		</mod>
		<mod id="q3ut42">
			<modname>Urban Terror 4.2</modname>
			<modicon>q3ut</modicon>
			<moddiscrim>gametype</moddiscrim>
			<customnames>true</customnames>
			<gametype id="0">FFA</gametype>
			<gametype id="3">TDM</gametype>
			<gametype id="4">TS</gametype>
			<gametype id="5">FTL</gametype>
			<gametype id="6">CAH</gametype>
			<gametype id="7">CTF</gametype>
			<gametype id="8">Bomb</gametype>
		</mod>
		<ignoreothers />
	</game>
	<game id="wsw">
		<gamename>Warsow</gamename>
		<gameicon>warsow</gameicon>
		<servertype>q3i</servertype>
		<mod id="warsow">
			<modname>Warsow</modname>
			<moddiscrim>gametype</moddiscrim>
			<team1name>Blue</team1name>
			<team2name>Red</team2name>
			<customnames>false</customnames>
			<gametype id="dm">FFA</gametype>
			<gametype id="duel">Duel</gametype>
			<gametype id="tdm">TDM</gametype>
			<gametype id="ctf">CTF</gametype>
			<gametype id="race">Race</gametype>
			<gametype id="insta">Instagib</gametype>
			<gametype id="ca">Clan Arena</gametype>
			<gametype id="da">Duel &amp; Quad</gametype>
		</mod>
	</game>
	<game id="rtcw">
		<gamename>Return to Castle Wolfenstein</gamename>
		<gameicon>rtcw</gameicon>
		<servertype>q3s</servertype>
		<cheatprotection>punkbuster</cheatprotection>
		<mod id="main">
			<modname>RTCW</modname>
			<moddiscrim>gametype</moddiscrim>
			<team1name>Allies</team1name>
			<team2name>Axis</team2name>
			<customnames>false</customnames>
			<gametype id="5">Multi-Player</gametype>
			<gametype id="6">Stop Watch</gametype>
			<gametype id="7">Check Point</gametype>
		</mod>
		<mod id="s4ndmod">
			<modname>S4NDMod</modname>
			<moddiscrim>gametype</moddiscrim>
			<team1name>Allies</team1name>